{
  "byte_bindings": {
    "exact": true,
    "reported": true,
    "unknown_fields": [],
    "values": {
      "catalog_sha256": "cd580436958c4b2d56068a6541382d508c972987c765420fbc5ae3a787899fb3",
      "dependency_lock_sha256": "d82764a06aafcba6a91aceac3a626686df3b64ca636b07cc728792d891020602",
      "installer_release_frame_sha256": "b9c23cbd73beb9fba9ee3e04c9f5073d1c86a1be23ee55c9b5ae4121ba794d19",
      "installer_release_frame_version": "rapp-roadside-installer-frame/1.0",
      "installer_sha256s": {
        "install.cmd": "4066d161da3adcee4c0963094bc937448d45589a0b864bfe0cd3b124a06f5ba3",
        "install.ps1": "17514fcc407397cfa7434fa6e9095fcdbc89be66ddc9652f1de003f4dec70b3b",
        "install.sh": "6ecf06f6dbbab6a920b5b208bc7c4069ca266b150d6c00533a00b5975a8417ca"
      },
      "ring": "stable-main",
      "ring_manifest_sha256": "63ffba818af5a9423a5522f6c752f57dd638d7794d044d07376ad65bcd584b51",
      "source_commit": "0000000000000000000000000000000000000000",
      "source_tree_sha256": "cd9b416ebb24fbc274b00b3b58b23e29618d71480343b52fda96f2012908242a",
      "unreported_fields": []
    }
  },
  "case_id": "synthetic-slow-setup",
  "closed_loop": {
    "automatic_actions": {
      "destructive_customer_repair": false,
      "git_push": false,
      "main_edit": false,
      "maintainer_feedback_network_send": false,
      "production_deploy": false,
      "teams_send": false
    },
    "contract": "rapp/closed-loop.json",
    "customer_state": "diagnose-locally",
    "name": "RAPP Roadside Closed Loop",
    "next_bounded_action": "bounded-wait-and-local-retest",
    "repair_requires_human_approval": true,
    "roadside_frame_embedded": true,
    "share_with_kody_inert": true
  },
  "evidence_partition": {
    "embedded_instructions_executed": false,
    "inferred": {
      "basis": [
        "bounded deterministic decision order",
        "sanitized observed fields only"
      ],
      "finding_code": "slow-first-boot-progressing",
      "reporting_ai_claim_ids": [
        "appears-slow"
      ]
    },
    "observed": {
      "attachments": [
        {
          "bytes": 81,
          "media_type": "application/json",
          "name": "setup-summary.json",
          "sha256": "18cc911cd3da43e17088c6962256a71fdc28fba9af01a0b91a0d71285e804001"
        }
      ],
      "fields": [
        "chat_http_status",
        "chat_method",
        "chat_path",
        "chat_request_field",
        "chat_response_keys",
        "health_http_status",
        "health_status",
        "installer_docs_mirrors_match",
        "launcher_present",
        "probe_mode",
        "python_version",
        "setup_elapsed_seconds",
        "setup_stage",
        "source_present"
      ],
      "reporting_ai_claim_ids": [
        "elapsed-seconds",
        "setup-stage"
      ]
    },
    "raw_reporting_ai_text_or_logs_retained": false
  },
  "finding": {
    "code": "slow-first-boot-progressing",
    "severity": "medium",
    "summary": "The bounded first boot is slow but still reports a known forward-progress stage."
  },
  "invariants": {
    "grail_modified": false,
    "new_rest_routes_allowed": false,
    "wire": {
      "method": "POST",
      "path": "/chat",
      "request_field": "user_input",
      "success_keys": [
        "response",
        "agent_logs",
        "session_id"
      ]
    }
  },
  "issue_signature": {
    "dedupe_key": true,
    "domain": "rapp-roadside:issue-signature/v1",
    "fields": {
      "environment_classes": {
        "filesystem": "ntfs",
        "managed_policy": "managed-restricted",
        "os_build": "windows-11-23h2",
        "platform": "windows",
        "shell": "powershell-7"
      },
      "fixed_code": "slow-first-boot",
      "input_hashes": [
        "45403098388a2231a424dd291448329d337d2fd7b18b83f8832de64f24416d69",
        "3b5df8fc67049911781bcd2689afff18ca5959c2c2965847a8a81638c0a8edd4"
      ],
      "installer_release_frame_sha256": "b9c23cbd73beb9fba9ee3e04c9f5073d1c86a1be23ee55c9b5ae4121ba794d19",
      "installer_release_frame_version": "rapp-roadside-installer-frame/1.0",
      "installer_sha256s": {
        "install.cmd": "4066d161da3adcee4c0963094bc937448d45589a0b864bfe0cd3b124a06f5ba3",
        "install.ps1": "17514fcc407397cfa7434fa6e9095fcdbc89be66ddc9652f1de003f4dec70b3b",
        "install.sh": "6ecf06f6dbbab6a920b5b208bc7c4069ca266b150d6c00533a00b5975a8417ca"
      },
      "phase": "agent-dependency-install",
      "ring": "stable-main",
      "ring_manifest_sha256": "63ffba818af5a9423a5522f6c752f57dd638d7794d044d07376ad65bcd584b51",
      "source_commit": "0000000000000000000000000000000000000000"
    },
    "identity_included": false,
    "queue_key": true,
    "raw_logs_included": false,
    "sha256": "ac4eba24708afa85dabce3f3bf9354eac5d7fac705a36fa5843b44df264d7484"
  },
  "issue_signature_domain": "rapp-roadside:issue-signature/v1",
  "machine_issue_artifact": "Roadside Frame",
  "maintainer_handoff": {
    "base": "main",
    "bounded_follow_up_limit": 1,
    "closed_loop_contract": "rapp/closed-loop.json",
    "forbidden": [
      "direct push to main",
      "new REST route beside POST /chat",
      "Grail/kernel rewrite",
      "credential collection"
    ],
    "repository": "kody-w/rapp-roadside",
    "required_flow": [
      "intake the hash-only Roadside Frame and independently reproduce",
      "create an isolated feature/fix checkout from stable main",
      "import the exact failing replay as a named regression test",
      "apply and retest the reviewed change in that checkout",
      "pass platform and ring matrices plus clean-machine installer tests",
      "promote one-way through Canary, Nightly, Alpha, then Beta soak",
      "perform a no-fast-forward release merge with rollback evidence",
      "bump VERSION only in the release merge when appropriate",
      "link issue, fix, test, and ring hashes in the release frame",
      "have the customer rerun the identical released test",
      "accept only successful confirmation as the verified resolution record"
    ],
    "soak_order": [
      "Canary",
      "Nightly",
      "Alpha",
      "Beta"
    ],
    "system": "RAPP Pit Crew"
  },
  "next_action": {
    "alternatives": [],
    "command_argv": [
      "py",
      "-3",
      "scripts/local_probe.py",
      "--workspace",
      ".",
      "--wait-seconds",
      "120",
      "--check-chat",
      "--allow-loopback",
      "--output",
      "observations.after.json"
    ],
    "expected": "GET /health is ok and POST /chat returns the success envelope.",
    "id": "bounded-wait-and-local-retest",
    "reason": "A progressing first boot should not be restarted or reinstalled prematurely.",
    "timeout_seconds": 150,
    "title": "Wait 120 seconds, then run one exact local retest",
    "writes": [
      "observations.after.json"
    ]
  },
  "observation_summary": {
    "chat_http_status": null,
    "chat_method": "POST",
    "chat_path": "/chat",
    "chat_request_field": "user_input",
    "chat_response_keys": [],
    "health_http_status": null,
    "health_status": "starting",
    "installer_docs_mirrors_match": true,
    "launcher_present": true,
    "probe_mode": "direct",
    "python_version": "3.11.9",
    "setup_elapsed_seconds": 95,
    "setup_stage": "agent-dependency-install",
    "source_present": true
  },
  "platform": "windows",
  "platform_policy_unknowns": {
    "catch_all_diagnosis_used": false,
    "reported": true,
    "unknown_fields": [],
    "values": {
      "architecture": "x86_64",
      "certificate_state": "system-store-observed",
      "clock_state": "monotonic-and-wall-clock-observed",
      "filesystem": "ntfs",
      "locale": "en-us",
      "managed_policy": "managed-restricted",
      "os_build": "windows-11-23h2",
      "proxy_state": "not-observed",
      "security_product_state": "present-vendor-undisclosed",
      "shell": "powershell-7"
    }
  },
  "privacy": {
    "credentials_collected": false,
    "external_network_used": false,
    "local_copy_only": true,
    "report_contains_log_bodies": false,
    "telemetry": false
  },
  "release_readiness": {
    "eligible": false,
    "required_gate": "RAPP Pit Crew isolated-checkout-Canary-Nightly-Alpha-Beta",
    "stable_main_direct_push": false
  },
  "replay_manifest": {
    "argv": [
      "brainstem.cmd",
      "start"
    ],
    "before_state_sha256": "3b5df8fc67049911781bcd2689afff18ca5959c2c2965847a8a81638c0a8edd4",
    "duration_ms": 95000,
    "input_sha256": "45403098388a2231a424dd291448329d337d2fd7b18b83f8832de64f24416d69",
    "logical_cwd": "<rapp-root>",
    "output_bytes": 61,
    "output_sha256": "6000ab6363314a2e05eea9dc52d4bc8a6ed2853d48540181075fabbe7e2c8af2",
    "phase": "agent-dependency-install",
    "raw_private_path_exported": false,
    "reported": true
  },
  "report_controls": {
    "age_seconds": 0,
    "correlation": {
      "disclosed": true,
      "id_present": false
    },
    "dedupe_count": 0,
    "dedupe_key": "ac4eba24708afa85dabce3f3bf9354eac5d7fac705a36fa5843b44df264d7484",
    "frame_verified": true,
    "quarantine_reasons": [],
    "quarantined": false,
    "rate": {
      "count": 1,
      "limit": 3,
      "window_seconds": 3600
    },
    "raw_report_data_globalized": false,
    "source_cell_id": "roadside-windows-synthetic",
    "source_verified": true,
    "transport_reported": true,
    "trust_weight_bps": 8000,
    "ttl_seconds": 86400
  },
  "report_id": "a281249e497b9661c2594e780ba9e75f048425a7c40f26ceae3e9013a853b221",
  "retest": {
    "assertions": [
      {
        "equals": "ok",
        "path": "health.status"
      },
      {
        "equals": 200,
        "path": "health.http_status"
      },
      {
        "equals": "POST",
        "path": "chat.method"
      },
      {
        "equals": "/chat",
        "path": "chat.path"
      },
      {
        "equals": "user_input",
        "path": "chat.request_field"
      },
      {
        "equals": 200,
        "path": "chat.http_status"